{"$schema":"https://json-schema.org/draft/2020-12/schema","type":"object","additionalProperties":false,"required":["evidence_version","exercise_id","backup_created_at","recovery_point_at","restore_started_at","restore_completed_at","rpo_minutes","rto_minutes","database_verified","keyring_verified","redis_restored","smoke_verified","result"],"properties":{"evidence_version":{"const":1},"exercise_id":{"type":"string","format":"uuid"},"backup_created_at":{"type":"string","format":"date-time"},"recovery_point_at":{"type":"string","format":"date-time"},"restore_started_at":{"type":"string","format":"date-time"},"restore_completed_at":{"type":"string","format":"date-time"},"rpo_minutes":{"type":"number","minimum":0,"maximum":15},"rto_minutes":{"type":"number","minimum":0,"maximum":60},"database_verified":{"const":true},"keyring_verified":{"const":true},"redis_restored":{"const":false},"smoke_verified":{"const":true},"result":{"const":"passed"}}}
