{"evidence_version":1,"exercise_id":"018f4f48-7b0a-7e3b-8f4f-9e8f0f8b1a31","backup_created_at":"2026-07-17T00:00:00Z","recovery_point_at":"2026-07-17T00:10:00Z","restore_started_at":"2026-07-17T00:12:00Z","restore_completed_at":"2026-07-17T00:42:00Z","rpo_minutes":10,"rto_minutes":30,"database_verified":true,"keyring_verified":true,"redis_restored":false,"smoke_verified":true,"result":"passed"}
